{
  "$ref": "#/definitions/projects",
  "definitions": {
    "projects": {
      "type": "object",
      "properties": {
        "name": {
          "type": "string"
        },
        "description": {
          "type": "string"
        },
        "githubUrl": {
          "type": "string",
          "format": "uri"
        },
        "iconUrl": {
          "type": "string",
          "format": "uri"
        },
        "contributions": {
          "type": "string"
        },
        "order": {
          "type": "number"
        },
        "$schema": {
          "type": "string"
        }
      },
      "required": [
        "name",
        "description",
        "githubUrl",
        "iconUrl"
      ],
      "additionalProperties": false
    }
  },
  "$schema": "http://json-schema.org/draft-07/schema#"
}